{
  "id": "gemini-omni-flash-050_generated_20_14046_case",
  "slug": "050-generated-20-14046-case-gemini-omni-flash",
  "title": "逼真的海岸跑车摄影",
  "category": "Atlas Generated T2V",
  "tags": [],
  "model": "gemini-omni-flash",
  "domain": "video",
  "inputMode": "text_to_video",
  "prompt": "A photorealistic, high-resolution automotive shot of a {argument name=\"car color\" default=\"bright red\"} {argument name=\"car model\" default=\"Ferrari F8 Tributo\"} parked on a {argument name=\"setting\" default=\"coastal road overlooking the ocean\"}. The sports car is positioned at a slight angle, showcasing its sleek aerodynamic curves, aggressive front fascia, distinct LED headlights, and silver alloy wheels with yellow center caps. The iconic yellow shield logo is visible on the front fender. The background features a deep blue sea, a low stone guardrail, and a distant rocky coastline covered in lush green vegetation and scattered buildings under a clear blue sky. The lighting is a {argument name=\"lighting\" default=\"bright sunny day\"}, casting sharp, realistic shadows on the asphalt and creating brilliant reflections on the car's glossy paint.",
  "variables": [],
  "referenceImageCount": 0,
  "source": {
    "caseUrl": "https://imagepromptgallery.com/models/gemini-omni-flash/prompts",
    "attribution": "Atlas Cloud Prompt Library"
  }
}
