{
  "id": "gemini-omni-flash-052_generated_22_14569_case",
  "slug": "052-generated-22-14569-case-gemini-omni-flash",
  "title": "优雅酒吧咖啡桌旁的女性",
  "category": "Atlas Generated T2V",
  "tags": [],
  "model": "gemini-omni-flash",
  "domain": "video",
  "inputMode": "text_to_video",
  "prompt": "A candid, photorealistic vertical photo of a woman seated at a rustic wooden table in an elegant upscale bar-cafe interior. She is centered in the foreground, leaning forward with one elbow on the table and her hand supporting her chin, giving a relaxed, intimate, editorial lifestyle feel. She has long, dark brown wavy hair parted near the middle, falling over both shoulders, and wears a fitted white ribbed long-sleeve scoop-neck top. On the table in front of her are exactly 3 visible objects: 1 peach-colored cocktail in a wide coupe glass on the left, 1 blue-and-white floral ceramic mug in the center-right, and 1 small clear glass bottle vase holding sparse dried stems on the far right. Behind her is a warmly lit, sophisticated bar with marble or stone finishes, ornate classical ceiling details, shelves of liquor bottles and glassware, glowing backbar lighting, and a bartender in a white shirt and dark apron working in soft focus. Include dark bar stools along the counter and a rich amber, cream, and brown color palette. Use shallow depth of field, soft natural indoor light mixed with warm bar lighting, realistic skin and fabric texture, subtle filmic tones, high-detail luxury hospitality photography, shot at eye level with a smartphone or portrait lens, vertical composition, cozy Parisian cafe meets hotel bar atmosphere.",
  "variables": [],
  "referenceImageCount": 0,
  "source": {
    "caseUrl": "https://imagepromptgallery.com/models/gemini-omni-flash/prompts",
    "attribution": "Atlas Cloud Prompt Library"
  }
}
