{
  "id": "gemini-omni-flash-040_generated_09_tw_001_1-minute-cinematic-war-video-in-5-minutes-multi-shot-structu",
  "slug": "1-minute-cinematic-war-video-in-5-minutes-multi-shot-structure-gemini-omni-flash",
  "title": "1-Minute Cinematic War Video in 5 Minutes, multi-shot structure",
  "category": "Atlas Generated T2V",
  "tags": [],
  "model": "gemini-omni-flash",
  "domain": "video",
  "inputMode": "text_to_video",
  "prompt": "Consistent style guideline for all shots: realistic cinematic war footage in a modern Middle Eastern desert village; dominant sandy yellow and gray-brown palette; harsh noon sunlight with hard shadows; drifting dust and gunpowder smoke; subtle handheld vibration; low-angle and ground-level framing to maximize tension and realism; modern light infantry gear without visible national identifiers; restrained, tense, and brutal atmosphere. Shot 1 : A modern infantry squad advances through narrow alleys between low adobe houses and damaged concrete walls. The camera tracks from behind at knee level, pushing forward as soldiers hug the walls and aim toward an unseen corner. Wind, distant metal clinks, and suspended dust establish dread. Shot 2 : A sudden close-quarters firefight erupts at the alley corner. Soldiers drop and press against the wall as rounds impact masonry, kicking up debris. Fast lateral camera pan with controlled shake, intermittent muzzle flashes, and silhouettes in broken windows increase claustrophobia and urgency. Shot 3 : The squad regains formation and enters a half-collapsed building. Over-shoulder follow shot into dim interior where shafts of sunlight cut through breached walls. Dust particles float in the beams; hand signals replace speech; distant gunfire echoes. Tone shifts from chaos to hyper-alert silence. Shot 4 : From a damaged rooftop, the squad secures a high vantage point over the village grid. Slow pullback in backlight, soldiers in silhouette with rifles still trained on unknown threats. Dust swirls in warm light; no clear victory or defeat. End on unresolved tension.",
  "variables": [],
  "referenceImageCount": 0,
  "source": {
    "caseUrl": "https://imagepromptgallery.com/models/gemini-omni-flash/prompts",
    "attribution": "Atlas Cloud Prompt Library"
  }
}
